{
  "schema_version": 2,
  "pass_number": 638,
  "status": "draft",
  "branch": "live-work-from-pass166",
  "toolkit_version": "repo-native-vNext",
  "rom_sha256": "06d1c2b06b716052c5596aaa0c2e5632a027fee1a9a28439e509f813c30829a9",
  "closed_ranges": [
    {
      "range": "C4:0810..C4:0830",
      "kind": "code_owner",
      "label": "ct_c4_0810_multi_entry_hub",
      "confidence": "high",
      "verification_status": "pending"
    }
  ],
  "new_labels": [
    "ct_c4_0810_multi_entry_hub"
  ],
  "confidence": {
    "structural": "medium",
    "semantic": "medium",
    "rebuild": "low"
  },
  "sources": {
    "source_1_pass638.json": "passes/manifests/legacy/pass638.json"
  },
  "notes": []
}