{
  "schema_version": 2,
  "pass_number": 475,
  "status": "draft",
  "branch": "live-work-from-pass166",
  "toolkit_version": "repo-native-vNext",
  "rom_sha256": "06d1c2b06b716052c5596aaa0c2e5632a027fee1a9a28439e509f813c30829a9",
  "closed_ranges": [
    {
      "range": "C0:7D66..C0:7D80",
      "kind": "tail_fragment",
      "label": "CT_C0_7D66_GFX_HANDLER_7CALLERS",
      "confidence": "high",
      "verification_status": "reviewed",
      "evidence": {
        "classification": "executable_boundary_fragment",
        "reasoning": "Aligned 65816 loads, stores, calls, branches, status-width transitions, and returns establish executable content; score-derived starts and ends remain insufficient for independent function ownership.",
        "review_source": "pre-disassembly review 2026-08-19"
      },
      "legacy_metadata": {
        "raw_target": {
          "addr": "C0:7D66",
          "label": "CT_C0_7D66_GFX_HANDLER_7CALLERS",
          "score": 4,
          "callers": 7,
          "start_byte": "86",
          "start_type": "STX",
          "end_marker": "RTS",
          "verified": true
        }
      }
    }
  ],
  "new_labels": [
    "CT_C0_7D66_GFX_HANDLER_7CALLERS"
  ],
  "confidence": {
    "structural": "medium",
    "semantic": "medium",
    "rebuild": "low"
  },
  "sources": {
    "source_1_pass475.json": "passes/manifests/legacy/pass475.json"
  },
  "notes": []
}