{
  "schema_version": 2,
  "pass_number": 520,
  "status": "draft",
  "branch": "live-work-from-pass166",
  "toolkit_version": "repo-native-vNext",
  "rom_sha256": "06d1c2b06b716052c5596aaa0c2e5632a027fee1a9a28439e509f813c30829a9",
  "closed_ranges": [
    {
      "range": "C0:CE3B..C0:CE5F",
      "kind": "code_owner",
      "label": "ct_c0_ce3b_function_37callers",
      "confidence": "medium",
      "verification_status": "pending"
    }
  ],
  "new_labels": [
    "ct_c0_ce3b_function_37callers"
  ],
  "confidence": {
    "structural": "medium",
    "semantic": "medium",
    "rebuild": "low"
  },
  "sources": {
    "source_1_pass520.json": "passes/manifests/legacy/pass520.json"
  },
  "notes": []
}