{
  "schema_version": 2,
  "pass_number": 298,
  "status": "reviewed",
  "branch": "live-work-from-pass166",
  "toolkit_version": "repo-native-vNext",
  "rom_sha256": "06d1c2b06b716052c5596aaa0c2e5632a027fee1a9a28439e509f813c30829a9",
  "closed_ranges": [
    {
      "range": "C0:6F08..C0:6F0B",
      "kind": "code_helper",
      "label": "ct_c0_6f08_unknown_function_score6_cluster",
      "confidence": "high",
      "verification_status": "reviewed",
      "parent_range": "C0:6EF9..C0:6F0C",
      "parent_label": "ct_c0_6ef9_score6_s27"
    }
  ],
  "new_labels": [
    "ct_c0_6f08_unknown_function_score6_cluster"
  ],
  "confidence": {
    "structural": "medium",
    "semantic": "medium",
    "rebuild": "low"
  },
  "sources": {
    "legacy_1_pass298.json": "passes/manifests/legacy/pass298.json"
  },
  "notes": []
}