{
  "schema_version": 2,
  "pass_number": 973,
  "status": "draft",
  "branch": "live-work-from-pass166",
  "toolkit_version": "repo-native-vNext",
  "rom_sha256": "06d1c2b06b716052c5596aaa0c2e5632a027fee1a9a28439e509f813c30829a9",
  "closed_ranges": [
    {
      "range": "CF:20D7..CF:20F0",
      "kind": "code_owner",
      "label": "ct_cf_20d7_rep_handler",
      "confidence": "high",
      "verification_status": "pending"
    }
  ],
  "new_labels": [
    "ct_cf_20d7_rep_handler"
  ],
  "confidence": {
    "structural": "medium",
    "semantic": "medium",
    "rebuild": "low"
  },
  "sources": {
    "source_1_pass973.json": "passes/manifests/legacy/pass973.json"
  },
  "notes": []
}