{
  "schema_version": 2,
  "pass_number": 993,
  "status": "reviewed",
  "branch": "live-work-from-pass166",
  "toolkit_version": "repo-native-vNext",
  "rom_sha256": "06d1c2b06b716052c5596aaa0c2e5632a027fee1a9a28439e509f813c30829a9",
  "closed_ranges": [
    {
      "range": "C3:0733..C3:0747",
      "kind": "code_owner",
      "label": "ct_c3_0733_phd_handler",
      "confidence": "high",
      "verification_status": "reviewed"
    },
    {
      "range": "C3:A3F1..C3:A419",
      "kind": "code_owner",
      "label": "ct_c3_a3f1_jsr_entry",
      "confidence": "high",
      "verification_status": "reviewed",
      "legacy_metadata": {
        "raw_single_function": true
      }
    }
  ],
  "new_labels": [
    "ct_c3_0733_phd_handler",
    "ct_c3_a3f1_jsr_entry"
  ],
  "confidence": {
    "structural": "medium",
    "semantic": "medium",
    "rebuild": "low"
  },
  "sources": {
    "legacy_1_pass993.json": "passes/manifests/legacy/pass993.json",
    "legacy_2_pass993_c3_session28.json": "passes/manifests/legacy/pass993_c3_session28.json"
  },
  "notes": [
    "41-byte function with complex control flow",
    "Adjacent to C3:A3E2, suggests functional grouping"
  ]
}