{
  "schema_version": 2,
  "pass_number": 1062,
  "status": "reviewed",
  "branch": "live-work-from-pass166",
  "toolkit_version": "repo-native-vNext",
  "rom_sha256": "06d1c2b06b716052c5596aaa0c2e5632a027fee1a9a28439e509f813c30829a9",
  "closed_ranges": [
    {
      "range": "C0:1212..C0:1227",
      "kind": "code_owner",
      "label": "ct_c0_1212_score6_s27",
      "confidence": "medium",
      "verification_status": "reviewed"
    }
  ],
  "new_labels": [
    "ct_c0_1212_score6_s27"
  ],
  "confidence": {
    "structural": "medium",
    "semantic": "medium",
    "rebuild": "low"
  },
  "sources": {
    "legacy_1_pass_1062_c0_1212.json": "passes/manifests/legacy/pass_1062_c0_1212.json"
  },
  "notes": []
}