{
  "schema_version": 2,
  "pass_number": 792,
  "status": "draft",
  "branch": "live-work-from-pass166",
  "toolkit_version": "repo-native-vNext",
  "rom_sha256": "06d1c2b06b716052c5596aaa0c2e5632a027fee1a9a28439e509f813c30829a9",
  "closed_ranges": [
    {
      "range": "D9:9AF4..D9:9B02",
      "kind": "data",
      "label": "ct_d9_9af4_graphics_data",
      "confidence": "high",
      "verification_status": "reviewed",
      "evidence": {
        "classification": "graphics_bitplane_data",
        "byte_prefix": "D0 20 90 81 EA 10 C0 08 90 08 A0 20",
        "reasoning": "Plane masks and bounded values do not form coherent callable execution.",
        "review_source": "pre-disassembly review 2026-08-18"
      }
    }
  ],
  "new_labels": [
    "ct_d9_9af4_graphics_data"
  ],
  "confidence": {
    "structural": "medium",
    "semantic": "medium",
    "rebuild": "low"
  },
  "sources": {
    "source_1_pass792.json": "passes/manifests/legacy/pass792.json"
  },
  "notes": []
}