{
  "schema_version": 2,
  "pass_number": 578,
  "status": "draft",
  "branch": "live-work-from-pass166",
  "toolkit_version": "repo-native-vNext",
  "rom_sha256": "06d1c2b06b716052c5596aaa0c2e5632a027fee1a9a28439e509f813c30829a9",
  "closed_ranges": [
    {
      "range": "C5:C0B7..C5:C130",
      "kind": "code_owner",
      "label": "ct_c5_c0b7_jsl_prologue",
      "confidence": "high",
      "verification_status": "pending"
    }
  ],
  "new_labels": [
    "ct_c5_c0b7_jsl_prologue"
  ],
  "confidence": {
    "structural": "medium",
    "semantic": "medium",
    "rebuild": "low"
  },
  "sources": {
    "source_1_pass578.json": "passes/manifests/legacy/pass578.json"
  },
  "notes": []
}