{
  "schema_version": 2,
  "pass_number": 833,
  "status": "draft",
  "branch": "live-work-from-pass166",
  "toolkit_version": "repo-native-vNext",
  "rom_sha256": "06d1c2b06b716052c5596aaa0c2e5632a027fee1a9a28439e509f813c30829a9",
  "closed_ranges": [
    {
      "range": "D1:27D3..D1:27F5",
      "kind": "data",
      "label": "ct_d1_27d3_graphics_data",
      "confidence": "high",
      "verification_status": "reviewed",
      "evidence": {
        "classification": "graphics_bitplane_data",
        "byte_prefix": "08 80 80 08 0E 01 2E 1E 00 22 C0 C0",
        "reasoning": "Repeated plane pairs and terminal fill bytes contradict a callable handler.",
        "review_source": "pre-disassembly review 2026-08-18"
      }
    }
  ],
  "new_labels": [
    "ct_d1_27d3_graphics_data"
  ],
  "confidence": {
    "structural": "medium",
    "semantic": "medium",
    "rebuild": "low"
  },
  "sources": {
    "source_1_pass833.json": "passes/manifests/legacy/pass833.json"
  },
  "notes": []
}