{
  "schema_version": 2,
  "pass_number": 794,
  "status": "draft",
  "branch": "live-work-from-pass166",
  "toolkit_version": "repo-native-vNext",
  "rom_sha256": "06d1c2b06b716052c5596aaa0c2e5632a027fee1a9a28439e509f813c30829a9",
  "closed_ranges": [
    {
      "range": "D2:8096..D2:80AE",
      "kind": "code_owner",
      "label": "ct_d2_8096_score6_cluster",
      "confidence": "high",
      "verification_status": "pending"
    }
  ],
  "new_labels": [
    "ct_d2_8096_score6_cluster"
  ],
  "confidence": {
    "structural": "medium",
    "semantic": "medium",
    "rebuild": "low"
  },
  "sources": {
    "source_1_pass794.json": "passes/manifests/legacy/pass794.json"
  },
  "notes": []
}