{
  "schema_version": 2,
  "pass_number": 1038,
  "status": "draft",
  "branch": "live-work-from-pass166",
  "toolkit_version": "repo-native-vNext",
  "rom_sha256": "06d1c2b06b716052c5596aaa0c2e5632a027fee1a9a28439e509f813c30829a9",
  "closed_ranges": [
    {
      "range": "C1:4383..C1:439B",
      "kind": "superseded",
      "label": "ct_c1_4383",
      "confidence": "medium",
      "verification_status": "superseded",
      "parent_range": "C1:4375..C1:438D",
      "parent_label": "ct_c1_4375",
      "evidence": {
        "reasoning": null,
        "findings": null,
        "score": 4
      },
      "legacy_metadata": {
        "raw_single_function": true,
        "ownership_adjudication_ids": [
          "adj_ce48805789e86a1f34b4"
        ]
      }
    },
    {
      "range": "C1:438E..C1:439B",
      "kind": "tail_fragment",
      "label": "ct_c1_4383__residual_438e_439b",
      "confidence": "high",
      "verification_status": "reviewed",
      "evidence": {
        "classification": "executable_boundary_fragment",
        "reasoning": "Instruction-aligned code is present, while caller and enclosing-owner analysis shows that score windows frequently begin at fall-through or operand offsets; ownership is therefore deferred to disassembly.",
        "review_source": "pre-disassembly review 2026-08-19"
      },
      "legacy_metadata": {
        "raw_single_function": true,
        "ownership_adjudication_ids": [
          "adj_ce48805789e86a1f34b4"
        ],
        "residual_of": "C1:4383..C1:439B",
        "coverage_treatment": "active_non_overlapping_residual"
      }
    }
  ],
  "new_labels": [
    "ct_c1_4383",
    "ct_c1_4383__residual_438e_439b"
  ],
  "confidence": {
    "structural": "medium",
    "semantic": "medium",
    "rebuild": "low"
  },
  "sources": {
    "source_1_pass1038.json": "passes/manifests/legacy/pass1038.json"
  },
  "notes": []
}