{
  "schema_version": 2,
  "pass_number": 253,
  "status": "reviewed",
  "branch": "live-work-from-pass166",
  "toolkit_version": "repo-native-vNext",
  "rom_sha256": "06d1c2b06b716052c5596aaa0c2e5632a027fee1a9a28439e509f813c30829a9",
  "closed_ranges": [
    {
      "range": "C0:05A2..C0:0600",
      "kind": "code_owner",
      "label": "ct_c0_05a2_unknown_function_score6_cluster",
      "confidence": "high",
      "verification_status": "reviewed"
    }
  ],
  "new_labels": [
    "ct_c0_05a2_unknown_function_score6_cluster"
  ],
  "confidence": {
    "structural": "medium",
    "semantic": "medium",
    "rebuild": "low"
  },
  "sources": {
    "legacy_1_pass253.json": "passes/manifests/legacy/pass253.json"
  },
  "notes": []
}