{
  "schema_version": 2,
  "pass_number": 324,
  "status": "draft",
  "branch": "live-work-from-pass166",
  "toolkit_version": "repo-native-vNext",
  "rom_sha256": "06d1c2b06b716052c5596aaa0c2e5632a027fee1a9a28439e509f813c30829a9",
  "closed_ranges": [
    {
      "range": "C0:9A1C..C0:9A31",
      "kind": "tail_fragment",
      "label": "ct_c0_9a1c_score10_multi_exit_function",
      "confidence": "high",
      "verification_status": "reviewed",
      "evidence": {
        "classification": "executable_boundary_fragment",
        "reasoning": "Aligned 65816 loads, stores, calls, branches, status-width transitions, and returns establish executable content; score-derived starts and ends remain insufficient for independent function ownership.",
        "review_source": "pre-disassembly review 2026-08-19"
      }
    }
  ],
  "new_labels": [
    "ct_c0_9a1c_score10_multi_exit_function"
  ],
  "confidence": {
    "structural": "medium",
    "semantic": "medium",
    "rebuild": "low"
  },
  "sources": {
    "source_1_pass324.json": "passes/manifests/legacy/pass324.json"
  },
  "notes": []
}