{
  "schema_version": 2,
  "pass_number": 667,
  "status": "draft",
  "branch": "live-work-from-pass166",
  "toolkit_version": "repo-native-vNext",
  "rom_sha256": "06d1c2b06b716052c5596aaa0c2e5632a027fee1a9a28439e509f813c30829a9",
  "closed_ranges": [
    {
      "range": "C4:C069..C4:C072",
      "kind": "data",
      "label": "ct_c4_c069_graphics_asset_data",
      "confidence": "high",
      "verification_status": "reviewed",
      "evidence": {
        "classification": "graphics_asset_data",
        "reasoning": "Repeated planes, masks, bounded indices, and record fields continue across claimed entries; opcode-count callers land inside those records.",
        "review_source": "pre-disassembly review 2026-08-19"
      }
    }
  ],
  "new_labels": [
    "ct_c4_c069_graphics_asset_data"
  ],
  "confidence": {
    "structural": "medium",
    "semantic": "medium",
    "rebuild": "low"
  },
  "sources": {
    "source_1_pass667.json": "passes/manifests/legacy/pass667.json"
  },
  "notes": []
}